{"$schema":"https://json-schema.org/draft/2020-12/schema","$id":"fivefold-incubator.d-tier-interleaving-check.v0","type":"object","additionalProperties":false,"required":["schemaVersion","candidateId","status","scope","method","gov227CandidateFingerprint","fixedWitness","lpModels","collisionControls","verdict","hypothesisDisposition","evidenceBindings","candidateFingerprint"],"properties":{"schemaVersion":{"const":"fivefold-incubator.d-tier-interleaving-check.v0"},"candidateId":{"const":"D_TIER_INTERLEAVING_CHECK_v0"},"status":{"const":"planning_evidence"},"scope":{"type":"object"},"method":{"type":"object"},"gov227CandidateFingerprint":{"type":"string","pattern":"^[0-9a-f]{64}$"},"fixedWitness":{"type":"object"},"lpModels":{"type":"array","minItems":3,"maxItems":3},"collisionControls":{"type":"object"},"verdict":{"enum":["confirmed","refuted","partial"]},"hypothesisDisposition":{"type":"object"},"evidenceBindings":{"type":"object"},"candidateFingerprint":{"type":"string","pattern":"^[0-9a-f]{64}$"}}}
