{"candidateFingerprint":"d320f40b64e7a49799dd47e93a4ba5b9fedf68a797e9f237379c1ea6865f67b1","candidateId":"D_TIER_INTERLEAVING_CHECK_v0","collisionControls":{"d2D5MultisetTwins":{"crossTierQTupleCollisionCount":0,"d2Forte":"7-15","d5Forte":"7-Z12","distinctRawSignatureMultisets":true,"interpretation":"rooted Q tuple required for discrimination, not the q_v2 multiset","sharedQMultiset":[2,3,3,6,6,7,7],"sharedUnweightedSum":34},"qV1Fidelity":[{"qV1Value":3,"qV2Value":3,"signature":[2,6]},{"qV1Value":2,"qV2Value":2,"signature":[3,6]},{"qV1Value":1,"qV2Value":1,"signature":[3,7]},{"qV1Value":3,"qV2Value":3,"signature":[4,6]},{"qV1Value":0,"qV2Value":0,"signature":[4,7]},{"qV1Value":2,"qV2Value":2,"signature":[4,8]}],"zPartnerD3D4":{"crossTierQTupleCollisionCount":0,"d3Forte":"7-Z37","d4Forte":"7-Z17","distinctQMultisets":true,"distinctRawSignatureMultisets":true,"intervalVectorsEqual":true,"sharedIntervalVector":[4,3,4,5,4,1]}},"evidenceBindings":{"canonicalLedgerSha256":"e6570972260fdae5c4ca878272dc89a9ff353d48762eefbe019707d229cd242d","gov227CandidateSha256":"48f476118324386da2ba6f10f10a5aefdd183341ea79e3b18a6727f3e24b76fc","gov227GeneratorSha256":"3f2b519e98ef73055c99d40645cadf7c9765a86b46a469de1ddc7adbb0b2ecfe"},"fixedWitness":{"adjacentComparisons":[{"gap":{"denominator":407,"numerator":3},"lowerTier":"A0","relation":"disjoint","upperTier":"A1"},{"gap":{"denominator":37,"numerator":2},"lowerTier":"A1","relation":"disjoint","upperTier":"A2"},{"gap":{"denominator":407,"numerator":-372},"lowerTier":"A2","relation":"overlap","upperTier":"D1"},{"gap":{"denominator":407,"numerator":1113},"lowerTier":"D1","relation":"disjoint","upperTier":"D2"},{"gap":{"denominator":407,"numerator":-117},"lowerTier":"D2","relation":"overlap","upperTier":"D3"},{"gap":{"denominator":407,"numerator":-1581},"lowerTier":"D3","relation":"overlap","upperTier":"D4"},{"gap":{"denominator":407,"numerator":516},"lowerTier":"D4","relation":"disjoint","upperTier":"D5"},{"gap":{"denominator":407,"numerator":-697},"lowerTier":"D5","relation":"overlap","upperTier":"D6"},{"gap":{"denominator":407,"numerator":-204},"lowerTier":"D6","relation":"overlap","upperTier":"D7"}],"declaredOrderStrictlySeparated":false,"tiers":[{"maximum":{"stateId":1387,"value":{"denominator":407,"numerator":346}},"minimum":{"stateId":2773,"value":{"denominator":407,"numerator":193}},"tier":"A0"},{"maximum":{"stateId":1389,"value":{"denominator":407,"numerator":574}},"minimum":{"stateId":1749,"value":{"denominator":407,"numerator":349}},"tier":"A1"},{"maximum":{"stateId":1397,"value":{"denominator":407,"numerator":860}},"minimum":{"stateId":1493,"value":{"denominator":407,"numerator":596}},"tier":"A2"},{"maximum":{"stateId":871,"value":{"denominator":407,"numerator":668}},"minimum":{"stateId":3289,"value":{"denominator":407,"numerator":488}},"tier":"D1"},{"maximum":{"stateId":3441,"value":{"denominator":407,"numerator":2198}},"minimum":{"stateId":2283,"value":{"denominator":407,"numerator":1781}},"tier":"D2"},{"maximum":{"stateId":2993,"value":{"denominator":407,"numerator":2462}},"minimum":{"stateId":2269,"value":{"denominator":407,"numerator":2081}},"tier":"D3"},{"maximum":{"stateId":631,"value":{"denominator":407,"numerator":1292}},"minimum":{"stateId":3229,"value":{"denominator":407,"numerator":881}},"tier":"D4"},{"maximum":{"stateId":3881,"value":{"denominator":407,"numerator":2102}},"minimum":{"stateId":671,"value":{"denominator":407,"numerator":1808}},"tier":"D5"},{"maximum":{"stateId":381,"value":{"denominator":407,"numerator":1600}},"minimum":{"stateId":1119,"value":{"denominator":407,"numerator":1405}},"tier":"D6"},{"maximum":{"stateId":4033,"value":{"denominator":37,"numerator":149}},"minimum":{"stateId":127,"value":{"denominator":407,"numerator":1396}},"tier":"D7"}],"weightDenominator":407,"weightNumerators":[116,56,41,35,77,44,38]},"gov227CandidateFingerprint":"c078171a73465e256b43ad4bc3a75c787866b582ec7783edf6e42c13e096b685","hypothesisDisposition":{"H1":"partial weakening: scalar evidence cannot supply every D4/D5 contact, office, or orientation condition","H2":"neutral; no ring-force enumeration occurred","H3":"partial support that non-scalar topology remains necessary; irreducibility is not proven"},"lpModels":[{"activeConstraintIds":[],"auditId":"declared-order-A0-through-D7","constraintCount":448,"constraintFingerprint":"3124a26254165320a3ae277205232fa271f1572a52504712ddc934ee1b56bdfc","iterations":15,"margin":null,"status":"WEAK_SYSTEM_INFEASIBLE","verification":"phase_one_exact_infeasibility","weights":null},{"activeConstraintIds":[],"auditId":"D1-through-D7","constraintCount":301,"constraintFingerprint":"9d59b9218058ce878d0615680a5845de1485baae37d1496e7282b974f3487fb7","iterations":15,"margin":null,"status":"WEAK_SYSTEM_INFEASIBLE","verification":"phase_one_exact_infeasibility","weights":null},{"activeConstraintIds":[],"auditId":"A-block-before-D-block","constraintCount":1036,"constraintFingerprint":"9b64296758708b099ab676647e84d6a4683b9958003e42adf82a6b1612e2ae06","iterations":15,"margin":null,"status":"WEAK_SYSTEM_INFEASIBLE","verification":"phase_one_exact_infeasibility","weights":null}],"method":{"fixedWitness":"all declared-adjacent signed gaps are retained in declared tier order","lpModels":"three exact models retain WEAK_SYSTEM_INFEASIBLE only when the exact solver reports that status","quotientControls":"D2/D5 q multiset and D3/D4 interval vector reject multiset, sum, and interval-vector tier classification","reproduction":"fresh GOV-227 generator output compared byte-for-byte with the checked sidecar","verdictSemantics":"confirmed=all gaps, all three exact models, and both controls reproduce; partial=one or more named model is LIMIT; refuted=other fresh valid contradiction"},"schemaVersion":"fivefold-incubator.d-tier-interleaving-check.v0","scope":{"comparisonUniverseAnchorCount":70,"dTierAnchorCount":49,"excluded":["satellites","boundary states","runtime","Neo4j","global harmonic.C_H"],"sourceCandidateId":"CH_D17_q_v2"},"status":"planning_evidence","verdict":"confirmed"}